{
  "$schema_file": "../schemas/work-state.schema.json",
  "schema": "work_state",
  "schema_version": "0.1",
  "task_id": "devswitchboard-conflict-recovery-008",
  "revision": 2,
  "lifecycle_state": "complete",
  "current_phase": "handoff",
  "authoritative_artifacts": [
    "dogfood/devswitchboard-conflict-recovery-008-conflict-report.json",
    "dogfood/devswitchboard-conflict-recovery-008-approved-handoff-revision-2.json",
    "docs/superpowers/specs/2026-08-21-conflict-lifecycle-enforcement.md",
    "docs/superpowers/plans/2026-08-21-conflict-lifecycle-enforcement.md",
    "dogfood/devswitchboard-conflict-recovery-008.json",
    "dogfood/devswitchboard-conflict-recovery-008-review.md"
  ],
  "active_route": {
    "$schema_file": "../schemas/routing-recommendation.schema.json",
    "schema": "routing_recommendation",
    "schema_version": "0.1",
    "task_id": "devswitchboard-conflict-recovery-008",
    "revision": 2,
    "phase": "handoff",
    "surface": "developer",
    "workflow": "developer_review",
    "resources": [
      "Approved Handoff Revision 2",
      "Revision 2 specification and implementation plan",
      "Remediated dedicated fresh-context review",
      "Focused RED and GREEN lifecycle regression evidence",
      "Fresh final verification evidence"
    ],
    "matched_rule": "R010",
    "rationale": [
      "All approved lifecycle enforcement, review remediation, and fresh verification are complete, so final authority returns to the developer."
    ],
    "developer_approval_required": false,
    "invalidation_conditions": [
      "The repository changes after final verification or the developer requests a new revision."
    ]
  },
  "completed_gates": [
    "Revision 1 Conflict Report checkpoint",
    "Developer approval of Approved Handoff Revision 2",
    "Repository-grounded architectural specification and plan",
    "Regression-first RED evidence",
    "Cross-record semantic enforcement",
    "Focused lifecycle regressions",
    "Post-implementation full repository verification",
    "Dedicated fresh-context review and remediation",
    "Final focused re-review",
    "Fresh final workflow-integrity regressions",
    "Fresh full repository verification",
    "Exact task inventory and Git whitespace verification"
  ],
  "reused_gates": [
    "Revision 1 requirement context and explanatory recovery aid",
    "Revision 1 feasibility evidence",
    "Baseline evidence at ee7499f4aea2a56bc3459f07f6b3ca5290c50650",
    "Existing isolated workspace"
  ],
  "workspace_state": "Conflict Report lifecycle enforcement is implemented, every valid Critical and Important review finding is remediated, and fresh final verification passes in the isolated workspace.",
  "verification_state": "passed",
  "next_safe_action": "developer_review",
  "blockers": []
}
