{
  "$schema_file": "../schemas/work-state.schema.json",
  "schema": "work_state",
  "schema_version": "0.1",
  "task_id": "devswitchboard-reroute-recovery-007",
  "revision": 2,
  "lifecycle_state": "complete",
  "current_phase": "handoff",
  "authoritative_artifacts": [
    "dogfood/devswitchboard-reroute-recovery-007-re-route-required.json",
    "dogfood/devswitchboard-reroute-recovery-007-approved-handoff-revision-2.json",
    "docs/superpowers/specs/2026-08-21-reroute-lifecycle-enforcement.md",
    "docs/superpowers/plans/2026-08-21-reroute-lifecycle-enforcement.md",
    "dogfood/devswitchboard-reroute-recovery-007-review.md",
    "dogfood/devswitchboard-reroute-recovery-007.json"
  ],
  "active_route": {
    "$schema_file": "../schemas/routing-recommendation.schema.json",
    "schema": "routing_recommendation",
    "schema_version": "0.1",
    "task_id": "devswitchboard-reroute-recovery-007",
    "revision": 2,
    "phase": "handoff",
    "surface": "developer",
    "workflow": "developer_review",
    "resources": [
      "Approved Handoff Revision 2",
      "Revision 2 specification and implementation plan",
      "Remediated dedicated fresh-context review",
      "Fresh final verification evidence"
    ],
    "matched_rule": "R010",
    "rationale": [
      "All approved lifecycle enforcement, review remediation, and fresh final verification are complete, so final authority returns to the developer."
    ],
    "developer_approval_required": false,
    "invalidation_conditions": [
      "The repository changes after final verification or the developer requests a new revision."
    ]
  },
  "completed_gates": [
    "Revision 1 Re-route Required checkpoint",
    "Developer approval of Approved Handoff Revision 2",
    "Repository-grounded architectural plan",
    "Regression-first RED evidence",
    "Cross-record semantic enforcement",
    "Focused lifecycle regressions",
    "Post-implementation full repository verification",
    "Dedicated fresh-context review and remediation",
    "Final focused re-review",
    "Fresh final workflow-integrity regressions",
    "Fresh full repository verification",
    "Exact task inventory and Git whitespace verification"
  ],
  "reused_gates": [
    "Revision 1 requirement context and explanatory recovery aid",
    "Baseline evidence at 0dc57cd52f645b273d2d8e7d4c655af07c03d053",
    "Existing isolated workspace"
  ],
  "workspace_state": "Normative reroute lifecycle enforcement is implemented, all Critical and Important review findings are remediated, and fresh verification passes in the isolated workspace.",
  "verification_state": "passed",
  "next_safe_action": "developer_review",
  "blockers": []
}
