{
  "$schema_file": "../schemas/work-state.schema.json",
  "schema": "work_state",
  "schema_version": "0.1",
  "task_id": "devswitchboard-conflict-recovery-008",
  "revision": 2,
  "lifecycle_state": "blocked_by_conflict",
  "current_phase": "implementation",
  "authoritative_artifacts": [
    "DevSwitchboard Dogfood #008 Approved Handoff revision 1",
    "dogfood/devswitchboard-conflict-recovery-008-conflict-report.json",
    "dogfood/devswitchboard-conflict-recovery-008.json",
    "docs/state-and-recovery.md"
  ],
  "active_route": {
    "$schema_file": "../schemas/routing-recommendation.schema.json",
    "schema": "routing_recommendation",
    "schema_version": "0.1",
    "task_id": "devswitchboard-conflict-recovery-008",
    "revision": 2,
    "phase": "implementation",
    "surface": "developer",
    "workflow": "resolve_intent_conflict",
    "resources": [
      "dogfood/devswitchboard-conflict-recovery-008-conflict-report.json",
      "Repository feasibility evidence",
      "Four explicit developer decision options"
    ],
    "matched_rule": "R004",
    "rationale": [
      "Machine enforcement and the non-negotiable prohibition on every machine-enforcement surface cannot both be preserved under live repository behavior."
    ],
    "developer_approval_required": true,
    "invalidation_conditions": [
      "The developer approves a revised intent that makes the goal and implementation constraints jointly feasible.",
      "New repository evidence proves that existing behavior already supplies complete Conflict Report lifecycle enforcement."
    ]
  },
  "completed_gates": [
    "Remote baseline refresh and exact-SHA check",
    "Isolated worktree creation",
    "Baseline workflow-integrity regressions",
    "Baseline full repository verification",
    "Codex Preflight",
    "Initial bounded explanatory implementation",
    "Controlled amendment activation",
    "Repository-grounded feasibility analysis",
    "Conflict classification"
  ],
  "reused_gates": [
    "Approved Revision 1 requirement and design",
    "Current Conflict Report contract",
    "Dogfood #007 Re-route Required semantics",
    "Shared baseline evidence at ee7499f4aea2a56bc3459f07f6b3ca5290c50650"
  ],
  "workspace_state": "The isolated branch contains the completed bounded explanatory aid plus Conflict Report, blocked Work State, and Dogfood checkpoint evidence. No verifier, regression, routing, contract, schema, or executable-tooling change was made after the conflict was confirmed.",
  "verification_state": "not_started",
  "next_safe_action": "Return the Conflict Report to Chat and the developer for a non-mutating intent decision.",
  "blockers": [
    "Approved requirements A and B cannot coexist through any safe implementation available in the current repository.",
    "Developer intent revision is required before strategy-dependent work may resume."
  ]
}
