{
  "$schema_file": "../schemas/work-state.schema.json",
  "schema": "work_state",
  "schema_version": "0.1",
  "task_id": "devswitchboard-bootstrap-001",
  "revision": 1,
  "lifecycle_state": "complete",
  "current_phase": "handoff",
  "authoritative_artifacts": ["docs/superpowers/specs/2026-08-20-devswitchboard-v0.1-design.md", "docs/superpowers/plans/2026-08-20-devswitchboard-bootstrap.md"],
  "active_route": {
    "$schema_file": "../schemas/routing-recommendation.schema.json",
    "schema": "routing_recommendation",
    "schema_version": "0.1",
    "task_id": "devswitchboard-bootstrap-001",
    "revision": 1,
    "phase": "handoff",
    "surface": "developer",
    "workflow": "developer_review",
    "resources": ["DEC-LICENSE-001", "remediated router finding", "fresh verification evidence"],
    "matched_rule": "R001",
    "rationale": ["The developer-owned license decision is applied and fresh verification returns final authority to the developer."],
    "developer_approval_required": false,
    "invalidation_conditions": ["The repository changes after final verification or the developer requests a new revision."]
  },
  "completed_gates": ["Codex Preflight", "Implementation planning", "Implementation", "Fresh review", "DEC-LICENSE-001 developer approval", "Fresh verification after intent update"],
  "reused_gates": ["Upstream approved brainstorming"],
  "workspace_state": "DEC-LICENSE-001 applied, router error remediated, and bootstrap freshly verified; repository remains uncommitted for developer review.",
  "verification_state": "passed",
  "next_safe_action": "developer_review",
  "blockers": []
}
